Rank,Niche_ID,Valid,Category,Pain,Reach,SAM,Triple_Filter,Positioning
1,jovenes-alopecia-temprana,TRUE,Demográfico,74,82,80000,PASS,"Tu pelo tiene solución médica. Cuanto antes, mejor."
2,otc-frustrados,TRUE,Journey Stage,70,78,70000,PASS,"Cuando el minoxidil deja de funcionar, necesitas un médico."
3,sin-diagnostico-medico,TRUE,Journey Stage,57,80,150000,PASS,"Antes de tratar, hay que diagnosticar. En 1 consulta sabrás qué tienes."
4,post-trasplante-sin-mantenimiento,TRUE,Journey Stage,76,65,25000,PASS,"Tu injerto necesita un médico que cuide lo que queda."
5,insatisfechos-otras-clinicas,TRUE,Journey Stage,71,72,12000,PASS,"La clínica donde el médico te dice la verdad."
